Simplest way to increase duplex formation rate; reduce the entropic barrier by fixing one strand [61]
Example of fixing one strand to increase duplex formation rate; nucleic acid probes are usually fixed [61]
How cells accomplish fixing one strand for hybridization; DNA and RNA exist in aggregates that can undergo phase separation or be localized within membranes [61]
Cellular components facilitating hybridization; a host of nucleic acid-binding proteins, including many helicases [61]
Energy source for helicases facilitating hybridization; adenosine triphosphate (ATP) hydrolysis [61]
Why ASOs could not work without certain cellular components; proteins and lipids that facilitate hybridization [62]
Discovery of a single ASO hybridization "facilitator" by Dr. Crooke's lab; never found one [62]
Believed reason for no single ASO hybridization facilitator; reaction is facilitated by RNA-Protein complexes [62]
Reason for slow developing ASO effects; slow kinetics of ASO hybridization to cognate RNA sequences [34, 62]
Approximate time for PS ASOs to enter cells and distribute to active sites; about 60 minutes [62]
Approximate time for PS ASOs to hybridize; 20 minutes [62]
Approximate time for PS ASOs to recruit RNase H1 and accumulate cleavages; 40 minutes [62]
ASO length (nucleotides); 16-20 nucleotides [32]
How ASOs identify cognate sequences in RNA; take advantage of the genetic code [32]
Specificity of 16-nucleotide or longer ASOs; can discriminate a single mismatch [32]
Stability of ASO-RNA duplex once formed; quite stable [32]
Method to enhance affinity and potency of ASOs; medicinal chemistry to design them to bind RNAs more avidly than natural RNA [63]
Binding speed of ASO to target RNA vs other drugs to receptors; much slower [63]
Belief about ASO-RNA hybridization in cells; likely facilitated [63]
Creator of phosphorothioate (PS) modification; Fritz Eckstein [64]
Chemical change in PS modification; substituted a sulfur for the non-bridging oxygen in the phosphate moiety [64]
Effect of sulfur in PS modification; dispersed the negative charge, making it more lipophilic [64]
PS (reason for selection over neutral modifications); believed ASOs would need to be amphipathic [65]
Dr. Crooke's concern about lipophilic ASOs; would become trapped in membranes or fat depots [65]
PS (impact on stability); provided some enhanced stability [65]
PS (impact on protein binding); dramatically changed it compared to phosphodiester (PO) [65, 66]
Substitutes for PS (discovery success); to date, no modification has yielded the behavior of PS ASOs [65, 66]
Surprising feature of PS backbone; protein binding (extent and diversity of proteins) [66]
Critical aspects of PS ASO protein binding; sensitivity to sequence, hydrophobicity of 2’-modifications, and number/placement of PS moieties [66]
What determines fates of PS ASOs throughout biology; protein interactions [67]
Feasibility of manipulating protein binding via PS ASO modification; feasible and important [67]
Future prospect for PS ASOs; true “designer PS ASOs” leveraging protein binding [67]
Pharmacokinetic properties of PS ASOs (importance); essential to understand [68]
PS ASO distribution and metabolism mechanisms (difference from small molecules); differ (nuclease metabolism vs cytochrome P450) [69]
Number of pharmacokinetic drug-drug interactions with PS ASOs; few [69]
Types of drug-drug interactions that can occur with PS ASOs; pharmacological and toxicological [69]
Example of pharmacological drug-drug interaction; SCN2A ASO and Dilantin [69]
SCN2A ASO (action); reduces level of a sodium channel [69]
Dilantin (action); a sodium channel inhibitor used to reduce seizures [69]
PK behavior of PS ASOs within a specific chemical class; quite consistent [69]
Implication of consistent PK behavior; enables selection of dose, dose frequency, and route of delivery [69]
Correlation between PK and PD properties for PS ASOs of same chemical class; strong [69]
Requirement for optimal PD behavior of PS ASOs; rigorous multi-step screening processes [69]
Extrapolating PS ASO behavior (challenge); challenging, requires experience and rigorous screening [70]
Initiator of ligand conjugation program at Ionis; Mano Manoharan [71]
Year ligand conjugation program started; 1990 [71]
Purpose of lipid conjugates in ASOs; to increase tissue uptake [71]
Experience with lipid conjugates (Ionis); negative, with toxicities and PS ASO trapped in membranes [71]
Common sites for ligand conjugation in an ASO; 5’ or 3’ ends [72]
Properties that linkers for ligands can vary in; length, lipophilicity, charge, and stability in biological systems [72]
Most notable success in ligand conjugation for ASOs; to enhance delivery to specific cells and tissues [73]
Requirements for effective ligand-enhanced delivery; identify highly expressed receptors delivering high ASO concentrations [73]
GalNAc (function in ASO conjugation); enhances delivery of ASOs to hepatocytes [73]
GalNAc (receptor it binds to); a scavenger receptor on hepatocytes, the asialoglycoprotein receptor [73]
Potency increase for hepatocyte targets with GalNAc conjugation; about 30-fold [73]
Surprising success in ASO conjugation (ligand type); GLP-1 analogs [74]
Effect of GLP-1 analog conjugation on PS ASO levels in beta cells; enormous increase [74]
Impact of GLP-1 analog conjugation; enabled targeting beta cells with PS ASOs for the first time [74]
Nature of GLP-1 receptors; G-protein coupled receptors [74]
Primary means of GLP-1 receptor internalization; desensitization via beta-arrestin [74]
Current focus for ligands to the transferrin receptor; enhancing delivery to skeletal and cardiac muscle and across the blood-brain barrier [74]
Toxic effects (dose dependency); dose-dependent [75]
Correlation of most chronic toxicities; with the total cumulative dose [75]
Correlation of some toxicities; with the peak drug concentration in an organ [75]
Plasma (consideration as an organ); a liquid organ [75]
Role of plasma; to integrate a number of stress responsive pathways [76]
Stress responsive pathways integrated by plasma; clotting cascade, complement cascade, Kinin-kallikrein cascade, acute phase reactant cascades, angiotensinogen cascade [76]
Key roles of blood cells and vascular endothelium; binding to various members of these pathways, including PS ASOs [76]
Abundant cell type playing a surface-activating role in plasma; platelets [76]
Origin and activation of protein factors in cascades; made in the liver as pro-proteins, activated by proteolytic cleavage [76]
Risk of activating these systems; activation of adaptive immunity and production of deleterious auto-antibodies [77]
Binding of PS ASOs to clotting factors; bind to liver-derived vitamin K dependent clotting factors [77]
Deleterious consequences observed from PS ASO binding to clotting factors; never observed any [77]
Binding of PS ASOs in the complement pathway; bind to factor H [78]
Factor H (role in complement pathway); key negative regulator of complement activation [78]
Factor H (species variation); vary among different species [78]
Affinity of NHP factor H for PS ASOs vs human factor H; NHP factor H appears to have a higher affinity [78, 79]
Effect of high PS ASO doses in NHP tox studies; complement activation in some animals [78]
Acute NHP deaths in early technology development (cause); complement activation [78]
NHP strains/types sensitivity to PS ASOs; Mauritius NHPs are the most sensitive [80]
Acute complement activation or adverse events observed in humans with PS ASOs; never observed any [79, 80]
Conditions for rare thrombocytopenia with PS 2’-MOE gapmers; very high chronic inflammation (e.g., TTR amyloidosis, familial chylomicronemia), >4 months dosing, 300mg/week S.C. [80]
Mechanism of thrombocytopenia from PS ASOs; binding to platelets, possibly slight complement activation, and anti-PS ASO anti-platelet antibodies [81]
Dependency of thrombocytopenia process; high peak plasma PS ASO concentrations [81]
Strategy to avoid thrombocytopenia risk (PS ASO doses); do not administer doses greater than 200-250mg [82]
Strategy for doses ≥300mg in humans to avoid toxicity; divide doses (e.g., two 150mg S.C. doses separated by 60 minutes) [83]
Binding of PS ASOs to plasma albumin; ensures they are not cleared rapidly in urine by filtration by the kidney [83]
PS ASO binding to albumin (drug-drug interactions); no drug-drug interactions due to albumin binding (don't bind at small molecule sites) [83]
Effects of PS ASOs on clotting factors (clinical significance); transient, not associated with clinically significant sequelae [79]
First step in ASO technology evolution (pharmacology); development of a theoretical framework to rationalize pharmacological observations [84]
Two essential concepts for adapting receptor theory to ASOs; RNAs as potential receptors and ASOs as agents altering RNA intermediary metabolism [84, 85]
Length of typical ASOs (nucleotides); 18-20 nucleotides [32, 84]
Potential number of receptor sites for ASOs in a pre-mRNA or mRNA; millions [84]
Three phases of pharmacological effects of drugs; Pre-receptor binding, receptor binding, and post-receptor binding [86]
Pre-receptor binding phase (drug action); drug "sampling biological space to identify its cognate binding site or receptor" [86]
Process in pre-receptor binding phase; drug binds to many sites, dissociates, and binds to progressively higher affinity sites [86]
Speed of pre-receptor binding phase for most drugs; quite rapid [86]
Speed of receptor binding phase for most drugs; extremely rapid [86]
Post-receptor binding phase (initiation); drug binding initiates a biological response (signal transduction) [86]
Effect of signal transduction on drug effect; amplifies it [86]
Speed and limitation of signal transduction; usually rapid and self-limited [86]
Source of most basic principles of ASO pharmacology; study of PS ASOs that form duplexes cleaved by RNase H1 [87]
Presence of free PS ASO in cells at pharmacological doses; likely little to no free PS ASO [88]
Reason for little to no free PS ASO in cells; extensive protein and nucleic acid binding [88]
Determination of PS ASO concentration at cellular sites; product of Kds for binding sites and concentration of those sites [88]
Mechanism of PS ASO binding to cognate RNA sequences; likely involves transfer from a protein or partially matched RNA sequence [88]
Accumulation of PS ASOs in mitochondria; never observed appreciable concentrations [89]
PS ASO activity observed in mitochondria; none observed [89]
Types of RNA PS ASOs can target in the cell; all types [90]
Effect of RNA structure on accessible sites for PS ASOs; more structured RNA means fewer accessible sites [90]
Highly structured/modified RNAs that PS ASOs can target; pre-r or rRNAs, small molecular weight RNAs, and tRNAs [90]
Other RNAs easily targeted by PS ASOs; Circular, long non-coding, and micro-RNAs [90]
Locations in the cell where PS ASOs can produce pharmacological effects; throughout the cell (except mitochondria) [91]
Specific locations of PS ASO activity in the nucleus; nucleus, nucleolus, paraspeckles, spliceosomes, and during transcription [91]
Specific locations of PS ASO activity in the cytoplasm; polysome and cytosol [91]
Purpose of ASOs; designed to produce a desired effect in humans (pharmacological agents) [91]
Purpose of most drugs; to treat or prevent disease, not "cure" [91]
Duration of treatment for most chronic diseases; continuous [91]
Purpose of dosing intervals; to replace drug that is metabolized and cleared, maintaining steady drug effect [91]
ASO binding sites; target sites, considered "receptors" [92]
Primary effort in drug discovery; to identify chemicals that can interact selectively with desired receptors [92]
Relationship between drug selectivity and therapeutic index; more selective drug means better therapeutic index [92]
Most important parameter to know about a drug; therapeutic index [93]
Most common calculation for therapeutic index; dose producing 50% maximal desired effect divided by dose producing half-maximal adverse effects [93]
Relationship between therapeutic index value and drug quality; greater therapeutic index means better drug [93]
Definition of a drug receptor; a site to which the drug binds that is coupled to a biological response that amplifies the effects of the drug [93]
Example of a drug acceptor; serum albumin [93]
Why serum albumin is a drug acceptor, not a receptor; binds many drugs but is not coupled to a biological response [93]
"Receptors" for ASOs (molecular nature); complimentary sequences in RNAs [94]
How ASOs achieve extraordinary specificity for target RNA sequence; use the genetic code [94]
Difference between traditional receptors and ASO "receptors" in coupling to biological response; traditional are directly coupled, ASO receptors are not [35, 94]
How ASOs produce effects on RNA; alter production or abundance, or maturation to final functional form [94]
Strength of ASO technology (versatility); can be designed to bind any type of RNA and cause degradation, altered processing, or blocked functions [94]
Start of all true antisense effects; binding of the ASO to its cognate sequence (receptor) in the target RNA [95]
Primary goal in ASO design improvement; to enhance designs of agonist-like ASOs [96]
What fuels sophisticated approaches to agonist-like ASO design; progress in understanding RNA biology and biochemistry [96]
Organization at the forefront of agonist-like ASO design; n-Lorem [96]


