RNA-targeted drug discovery (RTD) (primary advantage); particularly advantageous for genetically caused diseases [1]
Time for experienced scientists to become familiar with RTD basic principles; about two years [1]
Purpose of Dr. Stan Crooke's "Cliff Notes" on antisense technology; to shorten the time required to become an expert in RNA-targeted drug technology [2]
Nature of RTD technology; a chemically-based synthetic drug discovery platform [3]
Most critical step in creating RTD technology; invention of the medicinal chemistry of oligonucleotides [3, 4]
Medicinal chemistry (general purpose); seeks to modify chemicals to enhance their therapeutic goals [3]
Properties of all drugs (three categories); pharmacological (desired effects), pharmacokinetic (absorption, distribution, clearance), and toxicological (undesired effects) [3, 4]
Medicinal chemistry of oligonucleotides (goal); sought to instill good drug properties into oligonucleotides [3, 4]
Developers of the medicinal chemistry plan at Ionis; Dan Cook and Dr. Stan Crooke [5]
Primary foci for oligonucleotide modification; 2’-position of the sugar and replacing the phosphate as the inter-nucleotide linkage [5]
2’-position in ribose (what it determines); the shape of the ribose and its position relative to the nucleobase [5]
2’-position characteristics (what they define); affinity for a target RNA [5]
2’-OH in ribose (its role for oligonucleotides); critical for nuclease cleavage of an oligonucleotide [5]
Why phosphate as inter-nucleotide linkage had to be replaced; to avoid rapid nuclease digestion [6]
Choices for phosphate replacement in oligonucleotides; neutral (methyl-phosphonates or morpholinos) or charged (phosphorothioates) [6]
Result of neutral phosphate replacement and lipophilic nucleobases in molecules; would not distribute well but be trapped in lipid depots or membranes [6]
Result of phosphorothioate (PS) linkages in oligonucleotides; creates an amphipathic oligonucleotide for broader body and cell distribution [6]
Two forms of RNA-targeted drugs (RTDs) used today; single (antisense oligonucleotides or ASOs) and double stranded (small interfering RNAs or siRNAs) [4]
How ASOs and siRNAs differ; chemically, leading to distinct pharmacological, pharmacokinetic, and toxicological profiles [4]
Affinity of PS DNA or RNA for RNA (human safety); inadequate to be active at safe doses in humans [7]
Nature of PS ASOs; complex chemicals that interact with RNA and many proteins [7]
Factors affecting interactions of PS ASOs with proteins; PS content, the nature of 2’-modifications, and sequence [7]
Characteristics of PS ASOs affecting distribution; amphipathic, relatively small, flexible, and bind to plasma proteins [8]
Distribution pattern of PS ASOs; broadly to peripheral tissues [8]
PS ASO accumulation at low doses; well-vascularized organs accumulate the most PS ASO [8]
PS ASO accumulation at higher doses; primary tissues saturate, and PS ASOs can be delivered to secondary organs [8]
Metabolism of PS ASOs; by nucleases into fragments that no longer bind effectively to proteins [8]
Clearance of metabolized PS ASO fragments; from cells and organs, filtered by the kidney into urine [8]
Distribution time from plasma to peripheral organs for PS ASOs (t1/2); about 1 hour [9]
Clearance rate of PS ASOs from tissues; slowly, facilitating infrequent doses [9]
Sub-organ PK/PD properties of PS ASOs (use); guide target selection and dosing [9]
Factors affecting cell uptake and sub-cellular distribution of PS ASOs; protein binding [9]
Most productive delivery of PS ASOs occurs via; endosomal processes [9]
Challenging sites for targeted delivery of PS ASOs; skeletal muscle, cardiac muscle, some immune cells, and most solid cancers [9]
n-Lorem's goal for nano-rare patients; to discover, develop and provide individualized antisense medicines for free for life [10]
RNases H (family type); members of the nucleotidyl transferase family of endonucleases [11]
RNases H (cleavage mechanism for RNA); in-line hydrolytic mechanism [11]
Products of RNase H cleavage; 5’-phosphate, 3’-OH products [11]
Canonical RNase H1s reported in mammalian cells (number); three [11]
RNase H enzymes expressed in studied mammalian cells; RNase H1 and RNase H2 [11]
Other H type nuclease mentioned; Argonaute 2 [11]
Relative abundance of RNase H2 vs H1; at least 20-fold more abundant [11]
RNase H enzyme involved in ASO activity; only RNase H1 [11]
Reason for RNase H2 not being involved in ASO activity; believed to be chromatin associated [11]
RNase H2 activity in cell homogenates; accounts for cleavage rate and pattern after release from chromatin [11]
H1 (active form); active as a monomer [11]
H2 (active form); has 3 subunits and is active only as a multimer [11]
RNase H1 (four domains); mitochondrial leader sequence, "hybrid" domain, spacer domain, and catalytic domain [12, 13]
H1 mRNA (translation initiation sequences); two [12]
H1 mRNA (upstream open reading frame); an active uORF [12, 14]
Most cellular H1 (translation); translated from the second translation initiation site, does not contain the mitochondrial leader peptide [12]
N-terminal "hybrid binding" domain of H1 (affinity); has about the same affinity for any duplex [12, 13]
Carboxy terminus of H1 (contains); the catalytic domain [15]
Catalytic domain of H1 (homology); highly homologous to E. coli RNase H1 [13, 15]
Catalytic center of H1 (composition); a histidine, a glutamic acid residue, and two aspartic acids [15]
Enzymatic mechanism of H1 (dependency); magnesium-dependent [15]
Crystal structure of H1 (magnesium binding sites); shows two magnesium binding sites [15]
Total cellular concentration of H1; low [15]
Distribution of H1 in the cell; present throughout the cell [15]
Effect of knocking out H1; embryonically lethal [15]
Method used to generate viable H1 knockout mice; albumin promoter expressed late in gestation [15]
Observation in viable H1 knockout animals regarding R-loops; significant increases in R-loops in nuclear and mitochondrial DNA [15]
Effect of R-loops in H1 knockout animals; disrupted transcription of ribosomal genes [15]
First pathological observations in H1 knockout animals; mitochondrial dysfunction and altered fission/fusion [16]
Pathological observations following mitochondrial dysfunction in H1 knockout animals; liver failure [16]
Regulation of H1 levels; carefully regulated [14, 16]
Effect of H1 overexpression; acutely cytotoxic [16]
Minimum deoxynucleotides H1 requires in a duplex to cleave RNA; 4 [16]
Substituents that block H1 cleavage; 2’-methoxy in RNA and a 2’ substituent on the DNA strand [16, 17]
Optimal activity for H1; with a true DNA/RNA duplex [16]
Gapmer design (H1 activity); forms a duplex that is not optimal for H1 activity [16]
Effect of increasing DNA gap length on H1 enzymatic activity; increases [16]
Impact of 2-MOE gapmers on ASO potency; significant increase [16]
Binding of phosphorothioate (PS) oligonucleotides to H1; can bind in the hybrid binding domain and the catalytic domain [14, 18]
Effect of PS oligonucleotides binding to H1; disrupts the H1 structure [14, 18]
PS oligonucleotides (effect on enzyme); competitive inhibitors of the enzyme [18]
Best type of gapmer to use in H1 enzymatic assays; phosphodiester (PO) gapmer [18]
Feature of H1 catalytic domain easily oxidized; a pair of vicinal cysteines [13, 18]
Effect of oxidation on H1; forms a disulfide, disrupts structure, inactivates it [13, 18]
How to keep purified H1 enzyme active; keep it fully reduced [13, 18]
Metals that can support H1 enzymatic activity; Manganese and magnesium [18]
Metal resulting in greater H1 catalytic rate; Manganese [18]
H1 cleavage of 3’-RNA overhang; can cleave one to two nucleotides [18]
Factors influencing total and pattern of H1 cleavage; RNA sequence [19]
Effect of multiple cognate sites for an ASO on RNA cleavage; cleaved more rapidly in cells and test tubes [19]
Relationship between ASO binding sites and cleavage rate; rate increases linearly with increasing numbers of ASO binding sites [19]
Action of extra ASO binding sites on cleavage rate; act independently [19]
Processivity of H1; minimally processive [20]
H1 cleavage under single-hit conditions; can cleave a site and as many as two adjacent sites processively [20]
Nature of H1 cleavage sites under cellular conditions; a population of RNA molecules cleaved at different nucleotides [20]
Factors that can compete with H1 for duplex binding; multiple RNA-binding proteins (RBPs) [21]
Comparison of RBPs to H1 for PS ASO/RNA duplex binding; some appear more abundant or have greater affinity [21]
Effect of ribosomes on H1 cleavage rates; can compete with H1, reducing cleavage rates [21, 22]
H1 interactome (includes proteins like); DDX21 and NAT10 [14, 21]
Effect of DDX21 and NAT10 on H1; increase enzymatic activity [14, 21]
Post-H1 cleavage metabolism of RNA; further degraded by standard RNases [21]
Exonuclease for 5’-end cleavage in the nucleus after H1 cleavage; XRN2 [21]
Exonuclease for 5’-end cleavage in the cytoplasm after H1 cleavage; XRN1 [21]
Enzyme for 3’ degradation after H1 cleavage; the 3’-exonuclease complex [21]
Rate-limiting step in RNase H1 ASO pharmacology in cells; recruitment of H1 to the heteroduplex [23]
Activity locations of RNase H1; both the cytosol and the nucleus [23]
Relative H1 activity in nucleus vs. cytosol (volume adjusted); approximately equal [23, 24]
Most broadly used ASOs; PS ASO gapmers [23]
Mechanism of PS ASO gapmers (activity); robustly active in the nucleus and cytosol [23]
Types of RNAs lost due to H1 activating PS ASOs; pre-and mRNAs, snRNAs, pre-ribosomal and ribosomal RNAs, circular RNAs, and micro RNAs [23]
Effect of RNA copy number (1-400 copies/cell) on H1 activating PS ASO activity; unaffected [23, 25]
Factors reducing potency of gapmer PS ASOs in cells; multiple RNA-binding proteins and ribosomes [23]
Binding of PS ASOs with more hydrophobic 2’-modifications to H1; bind more tightly and can disrupt H1 structure [14]
Regulation of RNase H1 levels; carefully regulated [14]
H1 translation suppression; has an active uORF [14]
H1 transcription regulation; tightly regulated [14]
Theoretical foundation of drug discovery industry; receptor theory [26]
Year receptor theory was laid; 1900 [26]
Year the first receptor was cloned; 1980 [26]
Person who adapted traditional receptor theory for RNAs as "pharmacological receptors"; Dr. Stan Crooke [27]
Year RNA receptor theory was adapted; 1989 [27]
Importance of RNA receptor theory adaptation; essential step in creating the technology [27]
Role of specific targets in drug potency; bind more tightly than other sites and amplify effects of exogenous chemicals [27]
Drug targets prior to RNA therapeutics (type of molecule); specific proteins [28]
Two types of traditional drug targets; "receptors" or enzymes [28]
Traditional receptor (description); a protein designed to bind to a specific chemical (agonist) secreted by another cell [28]
Traditional receptor (function when agonist binds); coupled to a cell signaling process that amplifies the effect of the natural agonist [28]
Example of a natural agonist; Epinephrine [28]
Enzyme (description); usually proteins designed to bind to a specific body chemical (substrate) and chemically alter it [29]
Most drugs (design relative to natural chemical); designed to bind to the same site as the natural chemical [29]
Action of drugs (two types); agonists (do what natural chemical does) or antagonists/inhibitors (block effects) [29]
Speed of effects of agonists on recipient cells (traditional receptors); quite rapid [30]
Pharmacologically relevant interactions (traditional receptors); with mature receptor proteins coupled to a pathway [30]
What can be considered a "receptor" for an ASO; the cognate sequence in the RNA that binds an ASO [31]
What defines selectivity of ASO for its "receptor" sequence; number of nucleotide units that perfectly hybridize to the ASO [31]
ASO length capable of precisely discriminating desired binding sequence; 16 nucleotides or longer [31, 32]
ASO design compared to traditional drugs (specificity); can be rationally designed for much more specificity [31]
Analogy for small molecule binding to protein receptor; a button [31]
Analogy for ASO-RNA binding; a zipper [31, 32]
Number of binding sites in most proteins (for natural agonist/substrate); a single site [33]
Number of potential 16-mer receptor sequences for RNase H1 ASOs in target RNA; in principle, an infinite number [33]
Comparison of ASO receptor sites in target RNA to protein receptor sites; vastly larger than the 1 or 2 sites in protein receptors [33]
Efficiency and rapidity of ASO design compared to traditional small molecules; orders of magnitude more efficient and rapid [34]
ASO-RNA receptors (coupling to biological response); NOT directly coupled [34, 35]
Speed of ASO effects compared to traditional drugs; typically slower developing [34, 35]
Typical number of protein receptor molecules per cell; >100,000 [36]
Typical number of target RNA molecules per cell; 1-10 [36]
Effect of target RNA molecule number per cell on ASO potency; makes no difference [25, 36]
Effect of protein receptor number per cell on traditional drug activity; has a large effect [36]
Maturity of protein receptors (for pharmacological relevance); must be fully mature and coupled to a biological response [37]
When RNA receptors are targeted by ASOs; while the RNA is being processed and sent to cellular sites [37]
Versatility of ASO technology (reason); can be more versatile due to targeting RNAs during processing [37]
Biological effect if ASO interacts with pre-mRNA in nucleus; does not occur until mature mRNA in cytoplasm is degraded [37]
Critical factors affecting ASO activities (related to rates); rates of transcription, RNA splicing, and translation [38]
Importance of rates for most traditional drugs; do not matter [38]
Sequences in RNAs present in many/most RNAs (purpose); direct processing or utilization of the RNA [38]
Reason to avoid repetitive sequences in ASO design; binding would lead to effects on many RNAs [38]
Effectiveness of modified receptor theory devised in 1989 for ASOs; an effective way to rationalize drug effects [39]
ASOs (nature as chemicals); pharmacologically active chemicals [40]
Factors influencing cell phenotype effects of ASOs; many factors [40]
Potency of ASOs for highly abundant RNAs (e.g., ribosomal RNA, snRNAs, tRNAs, circular RNAs) compared to mRNAs; similar [25]
Effect of target RNA concentration if ASO molecules are greater than RNA; irrelevant [25]
Effect of basal transcription rate on ASO activity; appears not to affect activity, except for very rapidly transcribed genes like *Myc* [25]
Mechanism of tolerance with ASOs targeting near 3’-end of coding sequence; can result in a significant increase in target RNA transcription rate [25]
Activity of H1 ASOs during transcription; active on RNAs [24]
Potency of ASOs in nucleus vs cytoplasm (volume adjusted); comparable [24]
Most important factor affecting ASO activity; RNA structure [41]
Main reason for screening sites in RNA; RNA structure [41]
Most reproducible approach to define intracellular RNA structure; H1 ASO activity [41]
Nature of RNA structures; ephemeral [41]
Factors constantly modulating RNA structures; multiple RNA binding proteins and chaperones [41]
Effect of target sequence on H1 cleavage patterns and overall activity; a factor [17]
Impact of 2’-methoxy in RNA on H1 activity; blocks H1 activity at the modified nucleotide [17]
Variability of impact of single 2’-methoxy on H1 cleavage rate; can vary from zero to significant [17]
Effect of A-to-I editing on H1 cleavage; creates a mismatch, altering patterns and sometimes total rates [17]
Effect of an m6A modification on RNA-ASO duplex structure; induces subtle changes, usually not affecting total cleavage rate [17]
Ability of modern high-affinity ASOs to compete with RNA binding proteins; capable of competing to form ASO-RNA duplex [42]
Effect of several ribonucleoproteins competing with H1 for ASO-RNA duplex binding; significant reduction in H1 cleavage rates [21, 42]
Effect of number of cognate sites for an ASO in a target RNA; can make a big difference in cleavage rate and potency [42]
Impact of each new ASO binding site on cleavage rate; essentially doubles the rate [42]
Evidence of cooperativity for multiple ASO binding sites; none observed [42]
Differences in ASO potency based on site of binding; significant, relative to RNA architecture [43]
Sensitivity of exons vs introns to ASOs; exons are more sensitive than introns [43]
Difficulty in targeting specific introns; rapidly spliced introns are often difficult to target [22, 43]
Reduction in activity for ASOs binding in coding sequence; can be reduced in rapidly translated RNAs [22, 43]
Effect of stable RNAs and proteins on potency; potency may seem lower, but is in range of less stable ones at longer time points [43]
Role of RNase H1 level in ASO effects; both rate and extent of effect limiting [22]
Impact of changes in H1 level or activity on ASO potency; can significantly alter it [22]
Splicing rate (effect on ASO targeting); rapidly spliced introns are typically more difficult to target [22]
Translation rate (effect on ASOs in coding sequence); rapid translation can interfere with RNase H1 binding and reduce potency [22]
Factor recently suggested to affect ASO activity; glucose levels [22]
Likely mechanism for glucose affecting ASO activity; reduced rates of release from late endosomes [22]
Nature of the innate immune system; primordial host defense system present in all mammalian cells [44]
Primary role of innate immune system; identify intracellular threats and neutralize them [44]
Components of the innate immune system; sensors, and signaling and effector systems [44]
Relevant sensors for PS ASOs in innate immunity; nucleic acid sensors (pattern recognition receptors) [44]
Examples of pattern recognition receptors; toll-like receptors (TLRs), retinoic acid-inducible gene I (RIG-I), melanoma differentiation-associated protein 5 (MDA5), cyclic GAMP synthase (cGAS), stimulator of interferon genes (STING) [44]
Nucleic acid form recognized by TLR9; single stranded (ss) DNA [44]
Nucleic acid form recognized by TLR3; double stranded (ds) DNA [44]
Nucleic acid form recognized by TLR7/8; ssRNA [44]
Nucleic acid form recognized by RIG-I; ssRNA in cytoplasm [44]
Nucleic acid form recognized by MDA5; dsRNA [44]
Nucleic acid form recognized by STING and cGAS; cytosolic dsRNA [44]
TLRs signaling pathway; through NF-kB to induce cytokines and interferon regulatory factors (IRFs) to induce interferons [44]
Typical induction by other innate immune receptors (besides TLRs); interferons [44]
Distinguishing feature of mammalian DNA vs viral/bacterial DNA (for TLR9); mammalian DNA has methylated CpG motifs, viral/bacterial DNAs have unmethylated CpGs [45]
TLR9 sensitivity; acutely sensitive to unmethylated CpGs in ssDNA [45]
Potential consequences of activating innate immune system; activation of complement system, kallikrein/bradykinin pathway, angiotensinogen pathway, and adaptive immunity [45]
Possible catastrophic outcomes of innate immune system activation; vascular collapse [45]
Consequence of failure to terminate acute inflammatory responses; chronic systemic inflammation (CSI) [46]
CSI (causal role); thought to play a causal role in 50% of deaths in developed economies [46]
Effect of Poly IC and other polynucleotides (1970s work); could induce high, sometimes fatal, levels of interferon [46]
Nature of PS oligodeoxynucleotides (PS ODNs); highly pro-inflammatory [46]
Effect of PS ODNs in non-human primates (NHPs); fatal induction of innate immune activation coupled to complement activation [46]
Effect of PS ODNs in humans; severe injection site reactions, fever and chills [46]
Unpredicted benefit of 2’-MOE substitution in PS ASOs; dramatic reduction in immune stimulation [46]
Combined effect of 2’-MOE substitution and enhanced potency; allowed PS ASOs to be developed therapeutically [46]
Evidence for TLR9 involvement in PS ASO immune stimulation; studies in a TLR9 knockout mouse [46]
Sebastian Burel's finding on TLR9 activation; TLR9 was activated by 2’-modified PS ASOs in human PBMCs and BJAB cells [46]
Primary sensor of PS ASOs for innate immunity; TLR9 [47]
Range of agonist activity for PS ASOs; full to partial agonists [48]
Other activity of PS ASOs (besides agonists); potent competitive antagonists [48]
Kinetics of immune activation for full agonists; generally result in more rapid induction [48]
Action of some non-immune stimulatory PS ASOs; can act as true competitive antagonists for CpG and non-CpG-containing innate stimulatory PS ASOs [48]
Number of sites for PS ASOs on TLR9 monomers; two [48]
TLR9 state when activated; form homodimers [48]
Effect of altering entry into late endosomes (LEs) for PS ASOs; innate activation was reduced [48]
Effect of human serum albumin (HSA) on innate stimulation by PS ASOs; significantly reduced it [49]
Suspected mechanism of HSA's effect on innate stimulation; reducing the free PS ASO concentration [49]
Proteins that enhance immune activation by binding to PS ASOs and co-localizing with MyD88/TLR9 in LEs; histidine-rich glycoprotein (HSG), S100A8, and HMGB1 [49]
SAR of PS ASO induction of innate immunity (complexity); complex and may vary from cell type to cell type [50]
Importance of PS content and location in SAR; important [50]
PS ASOs unlikely to bind to TLR9 or activate innate immunity (PS content); less than 10 PSs [50]
Comparison of some PS/PO sequences to full PS ASOs (immune stimulation); can be more innate stimulatory [50]
Importance of CpG number and placement in immune stimulation; important, more CpG means worse immune stimulation [50, 51]
Effect of CpGs (influence); position influenced, complex [50]
General rule for more hydrophobic 2’-modifications (immune stimulation); generally more immune stimulatory [50]
Effect of site-selective modifications with mesyl-phosphonate or methoxy on innate stimulation; sometimes reduced, sometimes no effect [50]
Correlation of SAR with affinity to TLR9; none [50]
Action of some non-immune stimulatory PS ASOs in presence of innate stimulatory ASOs; cooperatively activate TLR9 [51]
Binding sites of cooperatively activating PS ASOs; likely differ from directly innate stimulatory ones (allosteric binders) [51]
Action of antagonistic PS ASOs; likely compete for the same sites as innate activating PS ASOs [51]
What should be avoided in PS ASO design (for innate immunity); CpGs [51]
Factors that can alter innate immune activation by PS ASOs; extracellular and intracellular proteins that bind PS ASOs [51]
Simple pattern of substitutions identified to reduce innate immune system induction; none identified [51]
Requirement for drugs in clinical trials/commercial use; manufactured in larger quantities meeting cGMP [52]
Requirements for drugs before use (purity, toxicity, storage); purity proven, impurities evaluated for toxicities, stored appropriately, demonstrate stability [52]
Common reasons for SMD development delays; challenges in scaling up synthetic schemes, proving purity, and lack of toxicities [53, 54]
ASO manufacturing status due to 35 years of work; well established [55]
Key factor making ASO technology more efficient; ASOs of the same chemical class have very similar properties [55]
Implication of similar properties for ASOs of same chemical class; a solution for one PS ASO is a solution for all [55]
Pioneers of solid-state synthesis of oligonucleotides; Lee Hood and Mike Hunkapiller (ABI) [56]
Increase in oligo production scale over time; 10^10 [56]
Reduction in oligo production costs over time; at least 10^8-9 [56]
PS ASO synthesis (reaction types); via routes not involving high-pressure or high-temperature reactions or exothermic reactions [57]
Stability of PS ASOs; quite stable [57]
Complexity of scaling up PS ASO manufacturing; reasonably straightforward [57]
Advances benefiting PS ASO manufacturing; solid state synthesizers and new, more efficient, and cost-effective solid supports [57]
Current scale of PS ASO manufacturing; ton-scale manufacturing easily achieved [57]
Availability of PS ASO vendors; multiple vendors can synthesize PS ASOs at scale [57]
Significant issue remaining in PS ASO manufacturing; reliance on acetonitrile (toxic solvent) [58]
Future expectation for manufacturing plants; more versatile and efficient, managing process from raw materials to sterile vials [58]
Current manufacturing process for ASOs; manufacturing at one site, then shipped to facilities for sterile fills [58]
Formation of a nucleic acid duplex (energetics); energetically unfavorable [59]
Rate-limiting step in nucleic acid duplex formation; nucleation (formation of the first few base pairs) [59]
Number of base pairs for nucleation in duplex formation; 3-5 [59]
Process after nucleation in duplex formation; the rest of the duplex is “zippered up” [59]
Speed of hybridization compared to other chemical reactions; very slow [59]
Duplex formation at 1:1 molar ratio of strands; very little duplex will form [59]
Time to achieve equilibrium at 20:1 molar ratio for duplex formation; many hours [59]
Method for forming duplex for Tm measurements; having one strand in great excess [59]
Relationship between Tm and duplex stability; higher Tm means stabler duplex [59]
Effect of mismatches on duplexes; destabilize duplexes [60]
Location of most destabilizing mismatches in a duplex; in the center [60]
Comparison of G:C mismatches to A:T (destabilization); G:C mismatches are more destabilizing [60]
Reason G:C mismatches are more destabilizing than A:T; 3 vs 2 hydrogen bonds [60]
Theoretical difference in maximum selectivity induced by single mismatch in 20-mer ASO:RNA duplex; fivefold [60]
